web-scraper-order,web-scraper-start-url,review_link,review_link-href,author,message,title,coord
"1711210737-1131","https://yandex.ru/maps/org/chempion/78146679294/","Отзывы","https://yandex.ru/maps/org/chempion/78146679294/reviews/","Сергей Нану","Совсем нет парковочных мест(для дома на 100 квартир,только штук 20 мест и то,если идеально будут парковаться))) по факту на мест 15 не более есть места) огромная проблема с вентиляцией. с автономнкой дома холодно!просчеты проектировки налицо,уже десяток проверок был,ошибки нашли.но как устранять не знают видимо(или дорого).","Чемпион","40.898342,57.732220"
"1711210737-1132","https://yandex.ru/maps/org/chempion/78146679294/","Отзывы","https://yandex.ru/maps/org/chempion/78146679294/reviews/","Сергей беляков","Панельный дом слышимость просто невыносимо","Чемпион","40.898342,57.732220"
"1711210737-1133","https://yandex.ru/maps/org/chempion/78146679294/","Отзывы","https://yandex.ru/maps/org/chempion/78146679294/reviews/","Соколов Владимир","Хорошее расположение, есть недочёты по благоустройству и количеству парковочных мест.","Чемпион","40.898342,57.732220"
"1711210737-1134","https://yandex.ru/maps/org/chempion/78146679294/","Отзывы","https://yandex.ru/maps/org/chempion/78146679294/reviews/","Евгений Смирнов","Хорошее место, новый район, такое ощущение что новом районе Москвы находишься, красивые дома с панорамным остеклением двор выложен плиткой, детская площадка","Чемпион","40.898342,57.732220"
"1711210737-1135","https://yandex.ru/maps/org/chempion/78146679294/","Отзывы","https://yandex.ru/maps/org/chempion/78146679294/reviews/","Александр Беспалов","ЖК красивый, но инфраструктуры нет","Чемпион","40.898342,57.732220"
"1711210737-1136","https://yandex.ru/maps/org/chempion/78146679294/","Отзывы","https://yandex.ru/maps/org/chempion/78146679294/reviews/","Андрей Мулюкин","Хорош уютный микрорайон","Чемпион","40.898342,57.732220"
"1711210737-1137","https://yandex.ru/maps/org/chempion/78146679294/","Отзывы","https://yandex.ru/maps/org/chempion/78146679294/reviews/","Ст См.","Комплекс выглядит отталкивающе. Устаревшие технологии, неряшливое строительство, дешёвые материалы... Основная причина появления столь непривлекательных строений в нашем замученном подобными застройщиками городе - жажда наживы.
Мне искренне жаль людей купивших квартиры в ЖК Чемпион","Чемпион","40.898342,57.732220"
"1711210737-1138","https://yandex.ru/maps/org/chempion/78146679294/","Отзывы","https://yandex.ru/maps/org/chempion/78146679294/reviews/","Татьяна Птичка","Квартира в новом доме, всегда отлично.","Чемпион","40.898342,57.732220"
"1711210746-1139","https://yandex.ru/maps/org/lesnoy_kvartal/55893139132/","Отзывы","https://yandex.ru/maps/org/lesnoy_kvartal/55893139132/reviews/","Мария Мишина","Очень хороший новый жилой комплекс!
Новый,современный,технологичный.
Там отличные детские площадки!Вы где нибудь видели батут?А качели паутинка?Качели для мамы с ребенком?Ручной экскаватор?А там это есть и не только это!","Лесной квартал","41.025101,57.735588"
"1711210746-1140","https://yandex.ru/maps/org/lesnoy_kvartal/55893139132/","Отзывы","https://yandex.ru/maps/org/lesnoy_kvartal/55893139132/reviews/","Oleg Berezin","Квартира 3х комнатная. Планировка хорошая, большая кухня и т.д. Минусы, газовая колонка посередине более чем 4 метровой стены, перенос от 60000 руб. Предлагают специалисты от застройщика. К тому же общая площадь после сдачи квартиры возрастает на 2 - 3 метра. Приходится доплачивать!!! 
А так место красивое, рядом школа, дет сад, детская поликлиника и лес. Детские площадки отгорожены от леса забором.","Лесной квартал","41.025101,57.735588"
"1711210746-1141","https://yandex.ru/maps/org/lesnoy_kvartal/55893139132/","Отзывы","https://yandex.ru/maps/org/lesnoy_kvartal/55893139132/reviews/","Денис Марков","Современный квартал. Новая школа, садик. Не плохого качества дома. Не очень много мест для парковки. У домов уклон асфальта сделан не в ту сторону, после дождя вся вода возле подъездов.","Лесной квартал","41.025101,57.735588"
"1711210746-1142","https://yandex.ru/maps/org/lesnoy_kvartal/55893139132/","Отзывы","https://yandex.ru/maps/org/lesnoy_kvartal/55893139132/reviews/","Максим Золотухин","Расположение выбрано удачное. Жилищный комплекс находится в лесополосе. Квартиры просторные. Во дворах сделаны игровые площадки для детей. Предусмотренный парковочные места для автомобилей. Малова то, но есть. Рядом школа и тц Солнечный.","Лесной квартал","41.025101,57.735588"
"1711210746-1143","https://yandex.ru/maps/org/lesnoy_kvartal/55893139132/","Отзывы","https://yandex.ru/maps/org/lesnoy_kvartal/55893139132/reviews/","Сергей Климанов","Заезжал к товарищу посмотреть новую квартиру. Очень впечатлил, выглядит очень круто. Дома красивые, подъезд очень красивый. Строителям которые делали обязательные работы по квартирам (газовый котел, батареи, проводка для котла) надо руки оторвать, сделано все через ору. Трубу газовую пропустили вдоль всего балкона, навели на кухню и сделали огромную петлю, кател закрепили по центру. Теперь на кухне половина стены занята трубой и катлом, мебель будет трудно подобрать.","Лесной квартал","41.025101,57.735588"
"1711210746-1144","https://yandex.ru/maps/org/lesnoy_kvartal/55893139132/","Отзывы","https://yandex.ru/maps/org/lesnoy_kvartal/55893139132/reviews/","Артем Волков","Подъезды неудобные, узкая дорога с вечной пробкой у школы. Не знаю кто догадался сделать такие узкие и аварийно опасные проезды. Парковок у домов немного и скорее всего не будет хватать для жильцов. Сомнительный «ЭКО» квартал прямо рядом с трассой.","Лесной квартал","41.025101,57.735588"
"1711210746-1145","https://yandex.ru/maps/org/lesnoy_kvartal/55893139132/","Отзывы","https://yandex.ru/maps/org/lesnoy_kvartal/55893139132/reviews/","Никита Богатков","Отличный район, рядом есть всё необходимое, детский сад, школа, детская поликлиника, всевозможные магазины и не только","Лесной квартал","41.025101,57.735588"
"1711210746-1146","https://yandex.ru/maps/org/lesnoy_kvartal/55893139132/","Отзывы","https://yandex.ru/maps/org/lesnoy_kvartal/55893139132/reviews/","Наталья Архипова","Очень уютный жилой комплекс,  тишина ,птички поют. Хорошие современные детские площадки. В шаговой доступности школа, садик, поликлиника.  Пока есть временные неудобства, идёт стройка других домов.","Лесной квартал","41.025101,57.735588"
"1711210746-1147","https://yandex.ru/maps/org/lesnoy_kvartal/55893139132/","Отзывы","https://yandex.ru/maps/org/lesnoy_kvartal/55893139132/reviews/","Натали","Друзья купили квартиру в доме № 11, при подписании акта приёма передачи решили проверить вентиляцию. А её вообще нету ни в одном из трёх каналов, не на приток не вытяжку, даже при открытых окнах! Куда смотрит застройщик! Обещали исправить в течении 30 дней. Да, ещё принимая во внимание отзыв застройщика, о законах физики, должны бы немного знать эти законы...
При открытых окнах, вентиляционные каналы в любом случае будут работать либо на вытяжку, либо на приток! На тот момент они вообще не работали! Следовательно были забиты! Причем тут котлы отопления! Хоть бы не позорились, писать такую чушь.","Лесной квартал","41.025101,57.735588"
"1711210746-1148","https://yandex.ru/maps/org/lesnoy_kvartal/55893139132/","Отзывы","https://yandex.ru/maps/org/lesnoy_kvartal/55893139132/reviews/","Андрей Лебедев","Район новый. Есть детский сад, школа . Рядом лес!  Торговый центр солнечный в шаговой доступности.  Я поставил 4 звезды из - за узкой дороги. Только в садик едут около сотни машин. А когда все дома введут в строй, я думаю там ездить будет не айс.","Лесной квартал","41.025101,57.735588"
"1711210746-1149","https://yandex.ru/maps/org/lesnoy_kvartal/55893139132/","Отзывы","https://yandex.ru/maps/org/lesnoy_kvartal/55893139132/reviews/","Наталия Ч","Красиво, чисто, современно. Хорошая детская площадка. Рядом садик, новая школа и новая детская поликлиника. Жк прямо у леса, нет шумных больших дорог рядом.","Лесной квартал","41.025101,57.735588"
"1711210746-1150","https://yandex.ru/maps/org/lesnoy_kvartal/55893139132/","Отзывы","https://yandex.ru/maps/org/lesnoy_kvartal/55893139132/reviews/","Vika-777887","Очень крутые дома качества высший уровень , в квартирах жара хотя грею на 58 в морозы , стены толстые вид крутой , вообщем дом мечты","Лесной квартал","41.025101,57.735588"
"1711210746-1151","https://yandex.ru/maps/org/lesnoy_kvartal/55893139132/","Отзывы","https://yandex.ru/maps/org/lesnoy_kvartal/55893139132/reviews/","Каспар Грандсбергис","Хороший квартал очень понравился, рядом садик, больница, школа, благоустройство хорошее, квартиры большие светлые панорамные окна в подъездах все очень красиво приятно сделано, были бы деньги точно купил бы там квартирку.","Лесной квартал","41.025101,57.735588"
"1711210746-1152","https://yandex.ru/maps/org/lesnoy_kvartal/55893139132/","Отзывы","https://yandex.ru/maps/org/lesnoy_kvartal/55893139132/reviews/","Максим Терпигорьев","Красивые дома, особенно нравится отделка подъездов и то что грузовые лифты(это важно при моей работе)))","Лесной квартал","41.025101,57.735588"
"1711210746-1153","https://yandex.ru/maps/org/lesnoy_kvartal/55893139132/","Отзывы","https://yandex.ru/maps/org/lesnoy_kvartal/55893139132/reviews/","Владимир Сотников","Тихо, спокойно, уютно,, красиво. Все в шаговой доступности. Садик и школа рядом.","Лесной квартал","41.025101,57.735588"
"1711210746-1154","https://yandex.ru/maps/org/lesnoy_kvartal/55893139132/","Отзывы","https://yandex.ru/maps/org/lesnoy_kvartal/55893139132/reviews/","Евгений Яблоков","Интересные дома. Удобные квартиры. Большие лестничные площадки способные вместить и велосипеды и детские коляскиВсё предусмотрено и парковка и детские площадки.","Лесной квартал","41.025101,57.735588"
"1711210746-1155","https://yandex.ru/maps/org/lesnoy_kvartal/55893139132/","Отзывы","https://yandex.ru/maps/org/lesnoy_kvartal/55893139132/reviews/","Андрей Кузьмичев","Меня почти всё устраивает. Всё рядом кроме одного магазина с продуктоми. Приходиться вечно бегать или ездить до магазина.","Лесной квартал","41.025101,57.735588"
"1711210746-1156","https://yandex.ru/maps/org/lesnoy_kvartal/55893139132/","Отзывы","https://yandex.ru/maps/org/lesnoy_kvartal/55893139132/reviews/","Игорь Смирнов","Доброго всем вечера —- ну что я могу сказать про это место о котором знаю доподлинно ведь я живу в этом районе . Начнём    Хуже идеи я считаю придумать было нельзя ведь вырубить гектары леса для очередной постройки нескольких многоэтажек  это обсурд  ведь в городе  достаточно земель где можно было произвести постройку без уничтожения такого количества зелёных наслаждений ; это рас . И где же соц опросы ; зелёные прокурорские работники и другие службы города которые так быстро и без сожалений пропустили уничтожение  такую кучу лесонасаждений ( больше никак и не назовёшь ; когда месяцами это просто вырубалось и вывозилось неизвестно куда и неизвестно для чего ) это два . И номер три ; нужно просто обратить внимание как это строится , глиняная грязь у стройки всегда , а это как выдумаете где ——- на одной дороге с детским садом , но это не все при забивании свай ( которое длится и в тихий час когда спят малышы и утром когда людям надо ехать на работу )происходит такой звон и вибрация что слышно на половину района .   Ну и Ps просто задумайтесь ; кому и для чего это надо и куда смотрят соответствующие люди которые должны все это контролировать и помогать простым людям жить в городах где не вырубают лес гектарами !!!","Лесной квартал","41.025101,57.735588"
"1711210746-1157","https://yandex.ru/maps/org/lesnoy_kvartal/55893139132/","Отзывы","https://yandex.ru/maps/org/lesnoy_kvartal/55893139132/reviews/","Максим Попов","Шикарное место, когда заезжаешь в этот район, ощущение, что ты в Костроме пропадает)))","Лесной квартал","41.025101,57.735588"
"1711210746-1158","https://yandex.ru/maps/org/lesnoy_kvartal/55893139132/","Отзывы","https://yandex.ru/maps/org/lesnoy_kvartal/55893139132/reviews/","АЛЕКСЕЙ","Очень хороший м-рн, всё рядом, новая школа, д. с., торговые центры","Лесной квартал","41.025101,57.735588"
"1711210746-1159","https://yandex.ru/maps/org/lesnoy_kvartal/55893139132/","Отзывы","https://yandex.ru/maps/org/lesnoy_kvartal/55893139132/reviews/","Марина Сивцова","Строя т аккуратно, но не нравится, что близко со школой и садиком некоторые дома, считаю неуместно это
Должно быть расстояние  больше от таких объектов","Лесной квартал","41.025101,57.735588"
"1711210746-1160","https://yandex.ru/maps/org/lesnoy_kvartal/55893139132/","Отзывы","https://yandex.ru/maps/org/lesnoy_kvartal/55893139132/reviews/","михаил жеребцов","На сегодняшний день лучший ЖК в Костроме.","Лесной квартал","41.025101,57.735588"
"1711210746-1161","https://yandex.ru/maps/org/lesnoy_kvartal/55893139132/","Отзывы","https://yandex.ru/maps/org/lesnoy_kvartal/55893139132/reviews/","Серый метельников","Нужное дело. Но все тоже время пустыри простаивают. Лесной массив очень жалко, получился бы отличный лыжный парк, парк отдыха, типа советского парка берендеевка.","Лесной квартал","41.025101,57.735588"
"1711210746-1162","https://yandex.ru/maps/org/lesnoy_kvartal/55893139132/","Отзывы","https://yandex.ru/maps/org/lesnoy_kvartal/55893139132/reviews/","Максим Ковалёв","Хочу здесь жить! Качество, скорость строительства, безопасность.","Лесной квартал","41.025101,57.735588"
"1711210746-1163","https://yandex.ru/maps/org/lesnoy_kvartal/55893139132/","Отзывы","https://yandex.ru/maps/org/lesnoy_kvartal/55893139132/reviews/","Юрий Ч","Большая парковка, всегда чистый дом, крутой лифт.","Лесной квартал","41.025101,57.735588"
"1711210746-1164","https://yandex.ru/maps/org/lesnoy_kvartal/55893139132/","Отзывы","https://yandex.ru/maps/org/lesnoy_kvartal/55893139132/reviews/","Dmitry","Парковочных мест не хватает.","Лесной квартал","41.025101,57.735588"
"1711210746-1165","https://yandex.ru/maps/org/lesnoy_kvartal/55893139132/","Отзывы","https://yandex.ru/maps/org/lesnoy_kvartal/55893139132/reviews/","Серега","Цена не соответсвует качеству в часности планировка квартир не понравилась","Лесной квартал","41.025101,57.735588"
"1711210746-1166","https://yandex.ru/maps/org/lesnoy_kvartal/55893139132/","Отзывы","https://yandex.ru/maps/org/lesnoy_kvartal/55893139132/reviews/","Александр Чуйко","Красиво. Лес рядом","Лесной квартал","41.025101,57.735588"
"1711210746-1167","https://yandex.ru/maps/org/lesnoy_kvartal/55893139132/","Отзывы","https://yandex.ru/maps/org/lesnoy_kvartal/55893139132/reviews/","Натали П","Очень жаль лес, все вырубили","Лесной квартал","41.025101,57.735588"
"1711210754-1168","https://yandex.ru/maps/org/venetsiya/102013176698/","Отзывы","https://yandex.ru/maps/org/venetsiya/102013176698/reviews/","Светлана Митченко","Спокойной микрорайон, чисто, единственное что рядом озеро или речка заросшая, весь вид портит, а так мне понравилась, квартира студия, чистенькая, есть всё не обходимое","Венеция","40.864147,57.754459"
"1711210754-1169","https://yandex.ru/maps/org/venetsiya/102013176698/","Отзывы","https://yandex.ru/maps/org/venetsiya/102013176698/reviews/","Любовь Волкова","Развитие инфраструктуры находится на начальной стадии:дороги (особенно весной можно заметить отсутствие как такового асфальтового покрытия-выбоины,страшно за себя и за машину),в зимний период они настолько узки,что двухсторонее движение а/транспорта затруднено.Микрорайон находится на окраине города и вижу имеются проблемы у оабочего населения и школьников уехать к месту работы/учебы.В Венеции имеется 2 магазина (Адмирал,пятерочка),что считаю недостаточным.Также есть большой детский сад.Конечно,есть  своего рода плюс,это как в деревне,может воздух чище,дома трехэтажные ,с высокой слышимостью(видимо застройщики очень экономили на звукоизоляции).И как подводя итог,микрорайон больше подойдет для возрастной категории населения.","Венеция","40.864147,57.754459"
"1711210754-1170","https://yandex.ru/maps/org/venetsiya/102013176698/","Отзывы","https://yandex.ru/maps/org/venetsiya/102013176698/reviews/","Надежда Надежда","Микрорайон расположен в пригороде Костромы, на мой взгляд тихий, спокойный район, ходят автобусы, имеются магазины в шаговой доступности. Если немного прогуляться можно выйти к реке, достаточно живописно","Венеция","40.864147,57.754459"
"1711210754-1171","https://yandex.ru/maps/org/venetsiya/102013176698/","Отзывы","https://yandex.ru/maps/org/venetsiya/102013176698/reviews/","Александр Анатольевич","Магазины, детский сад, детские площадки. Автобусное сообщение. 15-20 минут до центра Костромы. Чистый, опрятный и тихий микрорайон. Ценник на жильё конечно завышен.","Венеция","40.864147,57.754459"
"1711210754-1172","https://yandex.ru/maps/org/venetsiya/102013176698/","Отзывы","https://yandex.ru/maps/org/venetsiya/102013176698/reviews/","Артём","Район так себе, убитые дороги, и много переселенцев с расслееных домов которые ведут аморальный образ жизни. Из плюсов это окраина и спальный район.","Венеция","40.864147,57.754459"
"1711210754-1173","https://yandex.ru/maps/org/venetsiya/102013176698/","Отзывы","https://yandex.ru/maps/org/venetsiya/102013176698/reviews/","Игорь Захаров","Тихий райончик с наличием парковочных мест, для остановки на авто при посещении Костромы -- самое то!!!","Венеция","40.864147,57.754459"
"1711210754-1174","https://yandex.ru/maps/org/venetsiya/102013176698/","Отзывы","https://yandex.ru/maps/org/venetsiya/102013176698/reviews/","Лиза","Дома в целом хорошие, но не устраивает, что остановка находится не в шаговой доступности, хотелось бы поближе, мало транспорта в город, а из торговых центров одна ""Венеция"", в котором тоже не все товары есть...","Венеция","40.864147,57.754459"
