web-scraper-order,web-scraper-start-url,review_link,review_link-href,author,message,title,coord
"1711210577-713","https://yandex.ru/maps/org/kristall/178389582862/","Отзывы","https://yandex.ru/maps/org/kristall/178389582862/reviews/","Paper Dragon","Вот этот персонаж, вот он, закрывал мне обзор по утрам, а ещё установка новой плитки, моё любимое. Хорошо, что я переехал из соседнего дома, и теперь мне вид закрывают деревья и я могу жаловаться на них.","Кристалл","40.907524,57.742798"
"1711210577-714","https://yandex.ru/maps/org/kristall/178389582862/","Отзывы","https://yandex.ru/maps/org/kristall/178389582862/reviews/","Kenny","Отличный дом, приобретаем там квартиру)) отличная планировка, ждём сдачи дома, чтоб начать скорей ремонт!!! Главное все рядом :школы, садики, полликлинники взрослая и детская, магазины!!!!!","Кристалл","40.907524,57.742798"
"1711210577-715","https://yandex.ru/maps/org/kristall/178389582862/","Отзывы","https://yandex.ru/maps/org/kristall/178389582862/reviews/","Валерия Микерина","Я живу в доме на против. Когда я покупала квартиру, мне очень понравилось, что я смогу видеть восходы и закаты, но Ваша фирма решила построить дом, который я теперь всем телом не перевариваю.","Кристалл","40.907524,57.742798"
"1711210577-716","https://yandex.ru/maps/org/kristall/178389582862/","Отзывы","https://yandex.ru/maps/org/kristall/178389582862/reviews/","Александр Стрельников","Мне не нравится построили в претык к домам и дороге, вся пыль и выхлопные газы будут в квартире. Короче построили в неудачном месте и так тесно.","Кристалл","40.907524,57.742798"
"1711210577-717","https://yandex.ru/maps/org/kristall/178389582862/","Отзывы","https://yandex.ru/maps/org/kristall/178389582862/reviews/","Наталия Шишкина","Шикарный дом. Даже есть детская площадка.","Кристалл","40.907524,57.742798"
"1711210577-718","https://yandex.ru/maps/org/kristall/178389582862/","Отзывы","https://yandex.ru/maps/org/kristall/178389582862/reviews/","Алексей В.","будет замечательный дом, который украсит улицу Самоковскую!!!","Кристалл","40.907524,57.742798"
"1711210577-719","https://yandex.ru/maps/org/kristall/178389582862/","Отзывы","https://yandex.ru/maps/org/kristall/178389582862/reviews/","Алексей Смирнов","Красивый и современный дом 👍👍👍👍","Кристалл","40.907524,57.742798"
"1711210577-720","https://yandex.ru/maps/org/kristall/178389582862/","Отзывы","https://yandex.ru/maps/org/kristall/178389582862/reviews/","александр стрельников","Построили прямо возле дороги все выхлопные газы в окна.","Кристалл","40.907524,57.742798"
"1711210577-721","https://yandex.ru/maps/org/kristall/178389582862/","Отзывы","https://yandex.ru/maps/org/kristall/178389582862/reviews/","Olga Red","Будет наверно красиво! Но сейчас вроде строят этаж пятый!?","Кристалл","40.907524,57.742798"
"1711210577-722","https://yandex.ru/maps/org/kristall/178389582862/","Отзывы","https://yandex.ru/maps/org/kristall/178389582862/reviews/","Илья Козловский","Дом стоит на болоте)","Кристалл","40.907524,57.742798"
"1711210577-723","https://yandex.ru/maps/org/kristall/178389582862/","Отзывы","https://yandex.ru/maps/org/kristall/178389582862/reviews/","Дмитрий -","Хороший многоквартирный дом будет","Кристалл","40.907524,57.742798"
"1711210588-724","https://yandex.ru/maps/org/novy_gorod/112484891907/","Отзывы","https://yandex.ru/maps/org/novy_gorod/112484891907/reviews/","Светлана Стукалова","Новый район , хорошие парковки , современные детские сады , школы , стоматологические клиники , массажные и косметологические салоны , прекрасный магазин женской одежды , продуктовые магазины , детские площадки , тротуары для прогулок среди липовых аллей , соответствует современным требованиям !","Новый город","40.921707,57.745071"
"1711210588-725","https://yandex.ru/maps/org/novy_gorod/112484891907/","Отзывы","https://yandex.ru/maps/org/novy_gorod/112484891907/reviews/","Алексей Макаров","Новый город вдоль дорог окружён кирпичными домами, а внутри одни панельные и несколько трёх этажных от КФК, есть детский сад, достраивается школа, рядом ТРЦ РИО и много много всего, сам проживаю здесь, поэтому 5 звёзд.","Новый город","40.921707,57.745071"
"1711210588-726","https://yandex.ru/maps/org/novy_gorod/112484891907/","Отзывы","https://yandex.ru/maps/org/novy_gorod/112484891907/reviews/","Антон Моденов","Снаружи красивый комплекс. Со стороны двора напоминает гетто. Нет места для парковки. Нижние этажи - окна смотрят в соседние окна. Детская площадка для дома маловата, а рядом ещё несколько домов дети которых идут на эту площадку. Очень много людей.","Новый город","40.921707,57.745071"
"1711210588-727","https://yandex.ru/maps/org/novy_gorod/112484891907/","Отзывы","https://yandex.ru/maps/org/novy_gorod/112484891907/reviews/","Дмитрий Лазарев","Хорошее расположение, достаточно просторные дворы. Балкон отличный. Большая лоджия как комната. Сделали столовую. Вид отличный.","Новый город","40.921707,57.745071"
"1711210588-728","https://yandex.ru/maps/org/novy_gorod/112484891907/","Отзывы","https://yandex.ru/maps/org/novy_gorod/112484891907/reviews/","John F.","Дома красивые, возможно качественные, не жил, не знаю)) Но с местами парковки есть проблемы. Домов многоквартирных рядом стоит много, для машин места мало, тесновато.","Новый город","40.921707,57.745071"
"1711210588-729","https://yandex.ru/maps/org/novy_gorod/112484891907/","Отзывы","https://yandex.ru/maps/org/novy_gorod/112484891907/reviews/","Денис К.","Микрорайон лучшего качества проживания, все рядом : детский сад, магазины, строится новая школа, торговый центр РИО в шаговой доступности. У каждого дома детские функциональные детские площадки, оборудованные горками, качелями и всякими развлекалками для детей, так же за домом Ермакова 3 есть мини футбольное поле. Отличное место для проживания, единственный минус -это мало парковочных мест для авто.","Новый город","40.921707,57.745071"
"1711210588-730","https://yandex.ru/maps/org/novy_gorod/112484891907/","Отзывы","https://yandex.ru/maps/org/novy_gorod/112484891907/reviews/","Савелий Чурляев","Отличный район. Рядом детский сад, магазины, сервисы обслуживания. Удобно, рядом с мостом  . Хорошее состояние домов. Рядом строится новая школа. Всë отлично","Новый город","40.921707,57.745071"
"1711210588-731","https://yandex.ru/maps/org/novy_gorod/112484891907/","Отзывы","https://yandex.ru/maps/org/novy_gorod/112484891907/reviews/","Игорь С.","Хорошие дома, развитая инфраструктура, новый детский сад и в сентябре будет новая школа","Новый город","40.921707,57.745071"
"1711210588-732","https://yandex.ru/maps/org/novy_gorod/112484891907/","Отзывы","https://yandex.ru/maps/org/novy_gorod/112484891907/reviews/","Игорь Медведев","Живу рядом с этим местом. Гуляю часто. И всё-то мне нравится: и огромная парковка, и двор с площадками, и магазины внутри. И местоположение. Вообщем, Заволга рулит!","Новый город","40.921707,57.745071"
"1711210588-733","https://yandex.ru/maps/org/novy_gorod/112484891907/","Отзывы","https://yandex.ru/maps/org/novy_gorod/112484891907/reviews/","Елена","Все так пугают заволгой, думала, что долго буду после Давыдовского привыкать к этому району. Зря переживала. Садик в 5 минутах, школу достраивают, РИО рядом, пятёрки, магнит, озон, аптеки, парк рядом. Все нравится!","Новый город","40.921707,57.745071"
"1711210588-734","https://yandex.ru/maps/org/novy_gorod/112484891907/","Отзывы","https://yandex.ru/maps/org/novy_gorod/112484891907/reviews/","Victoria","Просторные квартиры, удобное расположен к. Но есть огромный минус - очень сильная слышимость в квартире","Новый город","40.921707,57.745071"
"1711210588-735","https://yandex.ru/maps/org/novy_gorod/112484891907/","Отзывы","https://yandex.ru/maps/org/novy_gorod/112484891907/reviews/","dobroded1962 Серёга.","Удобное местоположение все магазины в шаговой доступности. Есть дат. сад, скоро дудет школа, в перспективе по генплан в строящемся доме детская поликлиника. Единственная неприятность куча строительного мусора ул Даремская.","Новый город","40.921707,57.745071"
"1711210588-736","https://yandex.ru/maps/org/novy_gorod/112484891907/","Отзывы","https://yandex.ru/maps/org/novy_gorod/112484891907/reviews/","Елена Па","Мы переехали 4 года назад. Думала буду долго привыкать. Но к хорошему, говорят, быстро привыкаешь.  И это точно! Все новое и красивое: магазины, ТЦ, дороги. И всё рядом. Но больше всего радует, что рядом красавица Волга.","Новый город","40.921707,57.745071"
"1711210588-737","https://yandex.ru/maps/org/novy_gorod/112484891907/","Отзывы","https://yandex.ru/maps/org/novy_gorod/112484891907/reviews/","Валентина","Снимала квартиру. Квартира светлая и тёплая, 3 этаж, окна во двор. Газовое отопление, можно регулировать температуру. На первом этаже магазин пятёрочка. Огромный минус в том, что в соседних квартирах постоянно ремонт. Двор чистый, парковочные места есть, но с заселением жильцов их всё меньше и меньше. В целом обычная новостройка,","Новый город","40.921707,57.745071"
"1711210588-738","https://yandex.ru/maps/org/novy_gorod/112484891907/","Отзывы","https://yandex.ru/maps/org/novy_gorod/112484891907/reviews/","Кирилл Левченко","Снимаем офис в этом здании. Стены целые. Ничего не течёт. Тепло. На данный момент все хорошо. Притензию почти нет. Только регуляторы на батареях очень хандрят.","Новый город","40.921707,57.745071"
"1711210588-739","https://yandex.ru/maps/org/novy_gorod/112484891907/","Отзывы","https://yandex.ru/maps/org/novy_gorod/112484891907/reviews/","Сергей Папижук","Все рядом, и река Волга, и трц Рио, а так же супкрмаркет","Новый город","40.921707,57.745071"
"1711210588-740","https://yandex.ru/maps/org/novy_gorod/112484891907/","Отзывы","https://yandex.ru/maps/org/novy_gorod/112484891907/reviews/","Андрей Викторович Филатов","Всё не плохо. Плохо только одно. Власти и застройщики плюют на Человека, на всех. Была роща.... Продолжают уничтожать, вместо очистить её и сделать для людей. Мест море в Костроме и России. Ну прилипалам надо в Москве а и здесь обязательно вырубать рожи и сельхоз-земли. Не хотят тратиться на коммуникации... При этом дорожный Колапс уже практически есть....","Новый город","40.921707,57.745071"
"1711210588-741","https://yandex.ru/maps/org/novy_gorod/112484891907/","Отзывы","https://yandex.ru/maps/org/novy_gorod/112484891907/reviews/","Серега","Пожалуй самый лучший микрорайон в городе. Чисто уютно. Нет проблем с парковками. Все в шаговой доступности. Отличные дома.","Новый город","40.921707,57.745071"
"1711210588-742","https://yandex.ru/maps/org/novy_gorod/112484891907/","Отзывы","https://yandex.ru/maps/org/novy_gorod/112484891907/reviews/","Перец","очень красивые дома и хорошие и добрые","Новый город","40.921707,57.745071"
"1711210588-743","https://yandex.ru/maps/org/novy_gorod/112484891907/","Отзывы","https://yandex.ru/maps/org/novy_gorod/112484891907/reviews/","эдуард орловский","Новый город это лучшее место для проживания.","Новый город","40.921707,57.745071"
"1711210588-744","https://yandex.ru/maps/org/novy_gorod/112484891907/","Отзывы","https://yandex.ru/maps/org/novy_gorod/112484891907/reviews/","Дмитрий С","Самый лучший и уютный район города!!!!! В восторге от проживания!!!!","Новый город","40.921707,57.745071"
"1711210588-745","https://yandex.ru/maps/org/novy_gorod/112484891907/","Отзывы","https://yandex.ru/maps/org/novy_gorod/112484891907/reviews/","Иван Улегин","Лучший микрорайон","Новый город","40.921707,57.745071"
"1711210588-746","https://yandex.ru/maps/org/novy_gorod/112484891907/","Отзывы","https://yandex.ru/maps/org/novy_gorod/112484891907/reviews/","Виктор Глыбин","Хорошие квартиры! Детские площадки во дворе.","Новый город","40.921707,57.745071"
"1711210588-747","https://yandex.ru/maps/org/novy_gorod/112484891907/","Отзывы","https://yandex.ru/maps/org/novy_gorod/112484891907/reviews/","Lyasia_00","Хороший район","Новый город","40.921707,57.745071"
"1711210588-748","https://yandex.ru/maps/org/novy_gorod/112484891907/","Отзывы","https://yandex.ru/maps/org/novy_gorod/112484891907/reviews/","алексей шумов","Хороший район! Строится еще правда! Не все детские площадки оборудованы, но будет очень красиво и удобно!","Новый город","40.921707,57.745071"
"1711210588-749","https://yandex.ru/maps/org/novy_gorod/112484891907/","Отзывы","https://yandex.ru/maps/org/novy_gorod/112484891907/reviews/","Леза Дезза","Максимально хорошее место","Новый город","40.921707,57.745071"
"1711210588-750","https://yandex.ru/maps/org/novy_gorod/112484891907/","Отзывы","https://yandex.ru/maps/org/novy_gorod/112484891907/reviews/","Алексей Тищенко","Лучший жк!","Новый город","40.921707,57.745071"
"1711210588-751","https://yandex.ru/maps/org/novy_gorod/112484891907/","Отзывы","https://yandex.ru/maps/org/novy_gorod/112484891907/reviews/","Лариса Королева","Красиво","Новый город","40.921707,57.745071"
"1711210588-752","https://yandex.ru/maps/org/novy_gorod/112484891907/","Отзывы","https://yandex.ru/maps/org/novy_gorod/112484891907/reviews/","Тараканище","Нет школы, детям приходится ходить в школы пересекая оживленные трассы.","Новый город","40.921707,57.745071"
"1711210588-753","https://yandex.ru/maps/org/novy_gorod/112484891907/","Отзывы","https://yandex.ru/maps/org/novy_gorod/112484891907/reviews/","Елена Ремезова","Очень уютный Новый микрорайон.","Новый город","40.921707,57.745071"
"1711210588-754","https://yandex.ru/maps/org/novy_gorod/112484891907/","Отзывы","https://yandex.ru/maps/org/novy_gorod/112484891907/reviews/","MamKatya","Считаю удобным расположение микрорайона,дополненного новым детским садиком !","Новый город","40.921707,57.745071"
"1711210588-755","https://yandex.ru/maps/org/novy_gorod/112484891907/","Отзывы","https://yandex.ru/maps/org/novy_gorod/112484891907/reviews/","Лекс","нравится что все рядом и очень чисто.и очень удобное местоположение.","Новый город","40.921707,57.745071"
"1711210588-756","https://yandex.ru/maps/org/novy_gorod/112484891907/","Отзывы","https://yandex.ru/maps/org/novy_gorod/112484891907/reviews/","Василий","Настоящий муравейник","Новый город","40.921707,57.745071"
"1711210588-757","https://yandex.ru/maps/org/novy_gorod/112484891907/","Отзывы","https://yandex.ru/maps/org/novy_gorod/112484891907/reviews/","Сергей Алексеев","Спокойной новый район","Новый город","40.921707,57.745071"
"1711210588-758","https://yandex.ru/maps/org/novy_gorod/112484891907/","Отзывы","https://yandex.ru/maps/org/novy_gorod/112484891907/reviews/","Юрий Яблоков","Я работал по отделки дома хорошие квартиры и красивый вид на волгу😀","Новый город","40.921707,57.745071"
"1711210588-759","https://yandex.ru/maps/org/novy_gorod/112484891907/","Отзывы","https://yandex.ru/maps/org/novy_gorod/112484891907/reviews/","Alexandr","Типичный район в типичном городе","Новый город","40.921707,57.745071"
"1711210588-760","https://yandex.ru/maps/org/novy_gorod/112484891907/","Отзывы","https://yandex.ru/maps/org/novy_gorod/112484891907/reviews/","Виктория","Хороший жилой комплекс!","Новый город","40.921707,57.745071"
"1711210588-761","https://yandex.ru/maps/org/novy_gorod/112484891907/","Отзывы","https://yandex.ru/maps/org/novy_gorod/112484891907/reviews/","Алексей Драгайцев","Квартиры хорошие, минус-плохая водопроводная вода","Новый город","40.921707,57.745071"
"1711210588-762","https://yandex.ru/maps/org/novy_gorod/112484891907/","Отзывы","https://yandex.ru/maps/org/novy_gorod/112484891907/reviews/","Дмитрий Евсеев","Муравейник, АОГВ бред, лучше придомовая котельная","Новый город","40.921707,57.745071"
"1711210588-763","https://yandex.ru/maps/org/novy_gorod/112484891907/","Отзывы","https://yandex.ru/maps/org/novy_gorod/112484891907/reviews/","Игорь Сергеев","Автономное отопление, чистые подъезды","Новый город","40.921707,57.745071"
"1711210588-764","https://yandex.ru/maps/org/novy_gorod/112484891907/","Отзывы","https://yandex.ru/maps/org/novy_gorod/112484891907/reviews/","Максим Д.","Чисто и культурно.","Новый город","40.921707,57.745071"
"1711210588-765","https://yandex.ru/maps/org/novy_gorod/112484891907/","Отзывы","https://yandex.ru/maps/org/novy_gorod/112484891907/reviews/","Андрей У.","Красивый дом","Новый город","40.921707,57.745071"
"1711210588-766","https://yandex.ru/maps/org/novy_gorod/112484891907/","Отзывы","https://yandex.ru/maps/org/novy_gorod/112484891907/reviews/","Евгений Лешкин","Очень хорошее место","Новый город","40.921707,57.745071"
"1711210588-767","https://yandex.ru/maps/org/novy_gorod/112484891907/","Отзывы","https://yandex.ru/maps/org/novy_gorod/112484891907/reviews/","Аркадий С.","Купили тут квартиру. Ждём когда сдадут. Дом хороший","Новый город","40.921707,57.745071"
"1711210588-768","https://yandex.ru/maps/org/novy_gorod/112484891907/","Отзывы","https://yandex.ru/maps/org/novy_gorod/112484891907/reviews/","Nic1953","Большой выбор жилья.","Новый город","40.921707,57.745071"
"1711210588-769","https://yandex.ru/maps/org/novy_gorod/112484891907/","Отзывы","https://yandex.ru/maps/org/novy_gorod/112484891907/reviews/","Марти Макфлай","Отличный район","Новый город","40.921707,57.745071"
"1711210596-770","https://yandex.ru/maps/org/luchi/209277677087/","Отзывы","https://yandex.ru/maps/org/luchi/209277677087/reviews/","Алексей","Отличный комплекс. Хорошие, дружные соседи.","Лучи","40.919937,57.781380"
"1711210596-771","https://yandex.ru/maps/org/luchi/209277677087/","Отзывы","https://yandex.ru/maps/org/luchi/209277677087/reviews/","Марина Якушева","Хожу каждый день мимо на работу.  Очень нравится этот комплекс чистотой вокруг, придомовой территорией, закрытым двориком, где играют дети. Хорошей стоянкой для машин.","Лучи","40.919937,57.781380"
"1711210596-772","https://yandex.ru/maps/org/luchi/209277677087/","Отзывы","https://yandex.ru/maps/org/luchi/209277677087/reviews/","Егор Соловьев","Красивые дома! Друг живëт в однушке, ходил к нему, просторно!","Лучи","40.919937,57.781380"
"1711210596-773","https://yandex.ru/maps/org/luchi/209277677087/","Отзывы","https://yandex.ru/maps/org/luchi/209277677087/reviews/","Александр К.","Живу в Лучах год,всё хорошо и прекрасно.Соседи добрые,отзывчивые и не громкие.Всем желаю","Лучи","40.919937,57.781380"
"1711210596-774","https://yandex.ru/maps/org/luchi/209277677087/","Отзывы","https://yandex.ru/maps/org/luchi/209277677087/reviews/","Ирина Si.","Красивый комплекс, выглядит статно, фундаментально. Рядом остановки, магазин 5, садики, школы средняя 7 и музыкалка, зубная поликлинника, ТЦ Галерея и поликлинника для взрослых, АЗС.","Лучи","40.919937,57.781380"
"1711210596-775","https://yandex.ru/maps/org/luchi/209277677087/","Отзывы","https://yandex.ru/maps/org/luchi/209277677087/reviews/","Андрей Кожин","Удачное расположение.","Лучи","40.919937,57.781380"
