web-scraper-order,web-scraper-start-url,review_link,review_link-href,author,message,title,coord
"1711209963-1","https://yandex.ru/maps/org/po_ul_tereshkovoy_29/24386640130/","Отзывы","https://yandex.ru/maps/org/po_ul_tereshkovoy_29/24386640130/reviews/","Мария Рябинина","Очень хороший дом, сдаётся в предчистовой отделке, счётчики, электрика разведега, аогв есть, панорамные окна с тонировкой снаружи, планировки квартир шикарные. Закрытая территория, рядом только малоэтажные дома, из окон видно территорию детского сада, в котором имеется бассейн!","По ул. Терешковой, 29","40.915791,57.780945"
"1711209963-2","https://yandex.ru/maps/org/po_ul_tereshkovoy_29/24386640130/","Отзывы","https://yandex.ru/maps/org/po_ul_tereshkovoy_29/24386640130/reviews/","АБ","Эта новостройка пока ещё достраивается,но видно,что будет добротный дом с парковкой и близкой инфраструктурной, рядом детсад, поликлиники, магазины.","По ул. Терешковой, 29","40.915791,57.780945"
"1711209963-3","https://yandex.ru/maps/org/po_ul_tereshkovoy_29/24386640130/","Отзывы","https://yandex.ru/maps/org/po_ul_tereshkovoy_29/24386640130/reviews/","ШОХЗОДА Каршиев","Дом очень круто  но там есть один человек который называют его Денис он немного....","По ул. Терешковой, 29","40.915791,57.780945"
"1711209971-4","https://yandex.ru/maps/org/kupecheskiy_dom/138721908246/","Отзывы","https://yandex.ru/maps/org/kupecheskiy_dom/138721908246/reviews/","Александр П.","И не только был, но и принимал непосредственное участие в его реконструкции!!!","Купеческий дом","40.912472,57.776356"
"1711209971-5","https://yandex.ru/maps/org/kupecheskiy_dom/138721908246/","Отзывы","https://yandex.ru/maps/org/kupecheskiy_dom/138721908246/reviews/","Руслан","Очень хорошо 👍","Купеческий дом","40.912472,57.776356"
"1711209978-6","https://yandex.ru/maps/org/shkolnik/243820365328/","Отзывы","https://yandex.ru/maps/org/shkolnik/243820365328/reviews/","Сергей Измайлов","Хороший дом. Парковочных мест очень мало. Подъезд встречает приятной отделкой, что не типично для строительных организаций.","Школьник","40.942303,57.785378"
"1711209978-7","https://yandex.ru/maps/org/shkolnik/243820365328/","Отзывы","https://yandex.ru/maps/org/shkolnik/243820365328/reviews/","Светлана Соловьева","Дом не плохой, застройщик так себе. При сдаче дома обещали огородить территорию, а сами сбежали. Вообщем не надёжные ребята.","Школьник","40.942303,57.785378"
"1711209978-8","https://yandex.ru/maps/org/shkolnik/243820365328/","Отзывы","https://yandex.ru/maps/org/shkolnik/243820365328/reviews/","Natalya Sotnikova","Красивый дом!

Очень хорошие планировки квартир!

Дом расположен по второй линии от дороги

Близость к школам 35 и 18

В шаговой доступности магазины","Школьник","40.942303,57.785378"
"1711209978-9","https://yandex.ru/maps/org/shkolnik/243820365328/","Отзывы","https://yandex.ru/maps/org/shkolnik/243820365328/reviews/","Артем Лочехин","Дом построили на общественном пространстве, раньше здесь была прекрасная поляна, а теперь во это...","Школьник","40.942303,57.785378"
"1711209978-10","https://yandex.ru/maps/org/shkolnik/243820365328/","Отзывы","https://yandex.ru/maps/org/shkolnik/243820365328/reviews/","Алексей Волчихин","Очень хороший дом. Качественно построен. Школа рядом.","Школьник","40.942303,57.785378"
"1711209978-11","https://yandex.ru/maps/org/shkolnik/243820365328/","Отзывы","https://yandex.ru/maps/org/shkolnik/243820365328/reviews/","Роман","Красивый дом, нет ограждëнной территории.","Школьник","40.942303,57.785378"
"1711209978-12","https://yandex.ru/maps/org/shkolnik/243820365328/","Отзывы","https://yandex.ru/maps/org/shkolnik/243820365328/reviews/","Дмитриев Александр","Красивые современные квартиры","Школьник","40.942303,57.785378"
"1711209987-13","https://yandex.ru/maps/org/vysotka_na_borovoy/56657359753/","Отзывы","https://yandex.ru/maps/org/vysotka_na_borovoy/56657359753/reviews/","алексей с.","Современный дом расположился на бывшем пустыре и украсил собой существующую застройку. Красивый фасад и большая территория вокруг. Нет эффекта окна в окна. Высокая степень готовности. Большой выбор планировок квартир. Хороший и проверенный застройщик.","Высотка на Боровой","40.923153,57.800991"
"1711209987-14","https://yandex.ru/maps/org/vysotka_na_borovoy/56657359753/","Отзывы","https://yandex.ru/maps/org/vysotka_na_borovoy/56657359753/reviews/","Miss Glamour","Живу рядом, с балкона вижу как идет строительство с фундамента, как вместо арматуры в фундамент завалили всякий мусор. И это при том, что стройка идет на не осушеном болоте. Когда рыли котлован под фундамент воду отчерпывали ковшом. А так инфраструктура в шаговой доступности.","Высотка на Боровой","40.923153,57.800991"
"1711209987-15","https://yandex.ru/maps/org/vysotka_na_borovoy/56657359753/","Отзывы","https://yandex.ru/maps/org/vysotka_na_borovoy/56657359753/reviews/","владимир дмитриев","Прекрасный дом в тихом спальном районе","Высотка на Боровой","40.923153,57.800991"
"1711209987-16","https://yandex.ru/maps/org/vysotka_na_borovoy/56657359753/","Отзывы","https://yandex.ru/maps/org/vysotka_na_borovoy/56657359753/reviews/","Игорь Смирнов","Дом прекрасный, мне нравится!","Высотка на Боровой","40.923153,57.800991"
"1711209987-17","https://yandex.ru/maps/org/vysotka_na_borovoy/56657359753/","Отзывы","https://yandex.ru/maps/org/vysotka_na_borovoy/56657359753/reviews/","Дмитрий Новиков","Место хорошее ,до астоноваи автобусов и магазинов 100 метров. Шаола дп .сад под боаом.","Высотка на Боровой","40.923153,57.800991"
"1711209987-18","https://yandex.ru/maps/org/vysotka_na_borovoy/56657359753/","Отзывы","https://yandex.ru/maps/org/vysotka_na_borovoy/56657359753/reviews/","Олег Кузнецов","Перекрыл 2 проезд, затенять  будет другие дома, будут пробки на светофоре утром","Высотка на Боровой","40.923153,57.800991"
"1711209987-19","https://yandex.ru/maps/org/vysotka_na_borovoy/56657359753/","Отзывы","https://yandex.ru/maps/org/vysotka_na_borovoy/56657359753/reviews/","Глушич  Василий","Неинтересная планировка и расположение. Дорого","Высотка на Боровой","40.923153,57.800991"
"1711209987-20","https://yandex.ru/maps/org/vysotka_na_borovoy/56657359753/","Отзывы","https://yandex.ru/maps/org/vysotka_na_borovoy/56657359753/reviews/","Андрей Кожин","Хороший дом среди пятиэтажек","Высотка на Боровой","40.923153,57.800991"
"1711209994-21","https://yandex.ru/maps/org/lugovoy/146755728108/","Отзывы","https://yandex.ru/maps/org/lugovoy/146755728108/reviews/","Илья Дементьев","Нормальный дом с адекватной ценой в хорошем месте .","Луговой","40.889042,57.749275"
"1711209994-22","https://yandex.ru/maps/org/lugovoy/146755728108/","Отзывы","https://yandex.ru/maps/org/lugovoy/146755728108/reviews/","Настя Пухова","Долгострой у них нет денег несоветую!!!","Луговой","40.889042,57.749275"
"1711209994-23","https://yandex.ru/maps/org/lugovoy/146755728108/","Отзывы","https://yandex.ru/maps/org/lugovoy/146755728108/reviews/","павел майоров","Хорошая планировка, адекватная цена","Луговой","40.889042,57.749275"
"1711209994-24","https://yandex.ru/maps/org/lugovoy/146755728108/","Отзывы","https://yandex.ru/maps/org/lugovoy/146755728108/reviews/","Антон Давыдов","Данных о застройке нет ни у одного агентства","Луговой","40.889042,57.749275"
"1711210001-25","https://yandex.ru/maps/org/beregovaya_8a/242734519771/","Отзывы","https://yandex.ru/maps/org/beregovaya_8a/242734519771/reviews/","Сергей Фомин","Ещё только строится . Что хорошо: недалеко от остановки общественного транспорта, недалеко до детского сада, 400 метров до школы,  практически столько же до Ипатия. Что плохо: низина, рядом болотина, соответственно комары, летом лягушачьи концерты слушать. На подъезде к дому плохая дорога, ямы, а после дождей большие лужи.","Береговая, 8а","40.890961,57.782562"
"1711210001-26","https://yandex.ru/maps/org/beregovaya_8a/242734519771/","Отзывы","https://yandex.ru/maps/org/beregovaya_8a/242734519771/reviews/","Иван Иванов","Отличный дом в перспективе","Береговая, 8а","40.890961,57.782562"
"1711210001-27","https://yandex.ru/maps/org/beregovaya_8a/242734519771/","Отзывы","https://yandex.ru/maps/org/beregovaya_8a/242734519771/reviews/","Сергей К.","Была нормальная строительная компания, пока у учредителя и директора похоже не поехала ""крыша""! Разогнал всех, компанию продал и даже его родные не могут его найти!","Береговая, 8а","40.890961,57.782562"
"1711210001-28","https://yandex.ru/maps/org/beregovaya_8a/242734519771/","Отзывы","https://yandex.ru/maps/org/beregovaya_8a/242734519771/reviews/","сергей к.","Так и не движущееся строительство дома  в низине... Если и всё таки построят, мошкара и комары одолеют... Сырость...","Береговая, 8а","40.890961,57.782562"
"1711210001-29","https://yandex.ru/maps/org/beregovaya_8a/242734519771/","Отзывы","https://yandex.ru/maps/org/beregovaya_8a/242734519771/reviews/","Иван Б.","Полный отстой. Редкостное жулье. Собственно, отзыв уже не важен, так как фирма наделала кучу многомиллионных долгов и обанкротилась.","Береговая, 8а","40.890961,57.782562"
"1711210001-30","https://yandex.ru/maps/org/beregovaya_8a/242734519771/","Отзывы","https://yandex.ru/maps/org/beregovaya_8a/242734519771/reviews/","Владимир Мухин","Комплекс так и не построен","Береговая, 8а","40.890961,57.782562"
"1711210001-31","https://yandex.ru/maps/org/beregovaya_8a/242734519771/","Отзывы","https://yandex.ru/maps/org/beregovaya_8a/242734519771/reviews/","Орёл🤘","До сих пор стройка не начата(","Береговая, 8а","40.890961,57.782562"
"1711210001-32","https://yandex.ru/maps/org/beregovaya_8a/242734519771/","Отзывы","https://yandex.ru/maps/org/beregovaya_8a/242734519771/reviews/","Леонид Столяров","Кидают всех и вся!","Береговая, 8а","40.890961,57.782562"
"1711210016-33","https://yandex.ru/maps/org/po_ul_voykova/125101228090/","Отзывы","https://yandex.ru/maps/org/po_ul_voykova/125101228090/reviews/","YANA KAZAKOVA","Огражденная территория, есть место для парковки, чистые просторные подъезды с озеленением.
В квартирах: просторная кухня и комнаты, удобная планировка. Наличие балкона и индивидуальное отопление","По ул. Войкова","40.947762,57.765423"
"1711210023-34","https://yandex.ru/maps/org/vasilyevskoye_8a/7203374054/","Отзывы","https://yandex.ru/maps/org/vasilyevskoye_8a/7203374054/reviews/","Лариса Яковлева","Наконец то сделали дорогу к поселку,но придомовые территории ужас","Васильевское, 8а","40.976276,57.730518"
"1711210023-35","https://yandex.ru/maps/org/vasilyevskoye_8a/7203374054/","Отзывы","https://yandex.ru/maps/org/vasilyevskoye_8a/7203374054/reviews/","светлана шальнова","Хороший комплекс дорогу зделали наконец то но если в гости приезжаешь машину трудно припарковать мест мало","Васильевское, 8а","40.976276,57.730518"
"1711210023-36","https://yandex.ru/maps/org/vasilyevskoye_8a/7203374054/","Отзывы","https://yandex.ru/maps/org/vasilyevskoye_8a/7203374054/reviews/","Фарида Ш.","Ужасное место! Рядом женская исправительная колония! Энергетика отрицательная! Скоро начнутся проверки по поводу соблюдения расстояния застройки дома от колонии, так как там находится памятник истории и культуры. Возможно проверка будет не в пользу приобретателей жилья.....Я бы не хотела чтобы мои дети росли возле исправительного учреждения.....","Васильевское, 8а","40.976276,57.730518"
"1711210023-37","https://yandex.ru/maps/org/vasilyevskoye_8a/7203374054/","Отзывы","https://yandex.ru/maps/org/vasilyevskoye_8a/7203374054/reviews/","Ольга А.","Дом мало квартирный, уютная закрытая территория с воротами, конечно места во дворе мало,но и квартир немного. Вокруг зелёная зона, почти пригород, но чтобы доехать от дома до крупных магазинов, до Юбилейного м-рна, достаточно пяти минут. Планировки в доме не плохие, отопление АОГВ.","Васильевское, 8а","40.976276,57.730518"
"1711210023-38","https://yandex.ru/maps/org/vasilyevskoye_8a/7203374054/","Отзывы","https://yandex.ru/maps/org/vasilyevskoye_8a/7203374054/reviews/","Дмитрий С.","Хорошая экология, зеленый район","Васильевское, 8а","40.976276,57.730518"
"1711210023-39","https://yandex.ru/maps/org/vasilyevskoye_8a/7203374054/","Отзывы","https://yandex.ru/maps/org/vasilyevskoye_8a/7203374054/reviews/","Константин Ишунькин","Ужас! Под балконом огороды, вид на женскую колонию, хоть дом и новый, весь потолок в больших трещинах, шумоизоляция отсутствует от слова совсем.","Васильевское, 8а","40.976276,57.730518"
"1711210023-40","https://yandex.ru/maps/org/vasilyevskoye_8a/7203374054/","Отзывы","https://yandex.ru/maps/org/vasilyevskoye_8a/7203374054/reviews/","Наталья дерюгина","Там прекрасно!!","Васильевское, 8а","40.976276,57.730518"
"1711210023-41","https://yandex.ru/maps/org/vasilyevskoye_8a/7203374054/","Отзывы","https://yandex.ru/maps/org/vasilyevskoye_8a/7203374054/reviews/","Алена Г.","Трехэтажный, малоквартирный, кирпичный дом. Класс энергосбережения В. Вдали от отживленных дорог. Тихое, спокойное место. Плохо, что далековато садик, школа    магазин, нет никаких развивающих занятий  поблизости и фитнеса.","Васильевское, 8а","40.976276,57.730518"
"1711210023-42","https://yandex.ru/maps/org/vasilyevskoye_8a/7203374054/","Отзывы","https://yandex.ru/maps/org/vasilyevskoye_8a/7203374054/reviews/","дмитрий г.","Тихо,красиво,живут хорошие люди","Васильевское, 8а","40.976276,57.730518"
"1711210023-43","https://yandex.ru/maps/org/vasilyevskoye_8a/7203374054/","Отзывы","https://yandex.ru/maps/org/vasilyevskoye_8a/7203374054/reviews/","Дмитрий Майоров","Отличный дом","Васильевское, 8а","40.976276,57.730518"
"1711210030-44","https://yandex.ru/maps/org/neo/12697525759/","Отзывы","https://yandex.ru/maps/org/neo/12697525759/reviews/","Светлана","С виду замечательно. Главное есть детская площадка, есть куда детей привести погулять. Удобно и дивём недалеко. Внук мой полюбил здесь гулять.","Neo","40.992172,57.748188"
"1711210030-45","https://yandex.ru/maps/org/neo/12697525759/","Отзывы","https://yandex.ru/maps/org/neo/12697525759/reviews/","Евгений Борисович","Создана группа в конктакте для собственников - присоеденяйтесь) ЖК NEO Кострома Дом будет классный из плит и шубы","Neo","40.992172,57.748188"
"1711210030-46","https://yandex.ru/maps/org/neo/12697525759/","Отзывы","https://yandex.ru/maps/org/neo/12697525759/reviews/","mr-yamah","Судя по стройке дом будет блочный, выбирать нам","Neo","40.992172,57.748188"
"1711210030-47","https://yandex.ru/maps/org/neo/12697525759/","Отзывы","https://yandex.ru/maps/org/neo/12697525759/reviews/","Дмитрий .","Построили только два этажа пака","Neo","40.992172,57.748188"
"1711210039-48","https://yandex.ru/maps/org/na_ul_krupskoy_22/200580788722/","Отзывы","https://yandex.ru/maps/org/na_ul_krupskoy_22/200580788722/reviews/","Андрей Яблоков","расположение очень удобное, красивое, тихое, зелёное место. Но квартирки маленькие.","На ул. Крупской, 22","40.903683,57.753765"
"1711210039-49","https://yandex.ru/maps/org/na_ul_krupskoy_22/200580788722/","Отзывы","https://yandex.ru/maps/org/na_ul_krupskoy_22/200580788722/reviews/","Татьяна Зайкина","Тихое,уютное местечко, хороший подъезд к жилому комплексу. Самое то для спокойной жизни.","На ул. Крупской, 22","40.903683,57.753765"
"1711210039-50","https://yandex.ru/maps/org/na_ul_krupskoy_22/200580788722/","Отзывы","https://yandex.ru/maps/org/na_ul_krupskoy_22/200580788722/reviews/","Алексей Кискин","Дом строился при мне живу рядом , так вот та половина что без балконов связана армотурой чтоб не развалилась! Так как на старое настроили ещё 2 этажа , а вот вторая половина с фундамента новая","На ул. Крупской, 22","40.903683,57.753765"
"1711210039-51","https://yandex.ru/maps/org/na_ul_krupskoy_22/200580788722/","Отзывы","https://yandex.ru/maps/org/na_ul_krupskoy_22/200580788722/reviews/","Евгений Кузнецов","Снимали квартиру в этом доме. Сама квартира отличная. А дом оставляет желать лучшего. Звукоизоляция ужасная, что бы понять кто сверлит поле 23ч или громко веселится, придется обойти пару этажей.","На ул. Крупской, 22","40.903683,57.753765"
"1711210039-52","https://yandex.ru/maps/org/na_ul_krupskoy_22/200580788722/","Отзывы","https://yandex.ru/maps/org/na_ul_krupskoy_22/200580788722/reviews/","СВЕТЛАНА ШИШОВА","Дом не большой был перестроен из старого фонда и пристроена пристройка, окна не такие как на фото, игровой площадки нет","На ул. Крупской, 22","40.903683,57.753765"
"1711210039-53","https://yandex.ru/maps/org/na_ul_krupskoy_22/200580788722/","Отзывы","https://yandex.ru/maps/org/na_ul_krupskoy_22/200580788722/reviews/","Алексей П.","Нужно снять пауков и паутины со всех мест общего пользования.Скоро будут арки из паутин,пришлю фото губернатору.","На ул. Крупской, 22","40.903683,57.753765"
"1711210039-54","https://yandex.ru/maps/org/na_ul_krupskoy_22/200580788722/","Отзывы","https://yandex.ru/maps/org/na_ul_krupskoy_22/200580788722/reviews/","Василий Брунов","Хороший новый дом","На ул. Крупской, 22","40.903683,57.753765"
"1711210039-55","https://yandex.ru/maps/org/na_ul_krupskoy_22/200580788722/","Отзывы","https://yandex.ru/maps/org/na_ul_krupskoy_22/200580788722/reviews/","Евгений Кукушкин","Нужно обновление в этом направлении и развитии микрораёна","На ул. Крупской, 22","40.903683,57.753765"
"1711210039-56","https://yandex.ru/maps/org/na_ul_krupskoy_22/200580788722/","Отзывы","https://yandex.ru/maps/org/na_ul_krupskoy_22/200580788722/reviews/","Алёна Благодерова","Новый дом. Особо сказать не чего","На ул. Крупской, 22","40.903683,57.753765"
"1711210039-57","https://yandex.ru/maps/org/na_ul_krupskoy_22/200580788722/","Отзывы","https://yandex.ru/maps/org/na_ul_krupskoy_22/200580788722/reviews/","Марья.Д","Сарай!!!! Не когда его домом не назвать","На ул. Крупской, 22","40.903683,57.753765"
"1711210039-58","https://yandex.ru/maps/org/na_ul_krupskoy_22/200580788722/","Отзывы","https://yandex.ru/maps/org/na_ul_krupskoy_22/200580788722/reviews/","Я","Малоэтажная,роща ,Волга","На ул. Крупской, 22","40.903683,57.753765"
"1711210039-59","https://yandex.ru/maps/org/na_ul_krupskoy_22/200580788722/","Отзывы","https://yandex.ru/maps/org/na_ul_krupskoy_22/200580788722/reviews/","Ксения Б.","Очень маленькие комнаты","На ул. Крупской, 22","40.903683,57.753765"
"1711210057-60","https://yandex.ru/maps/org/na_festivalnoy/110497347496/","Отзывы","https://yandex.ru/maps/org/na_festivalnoy/110497347496/reviews/","Мария Рябинина","Отличный малоэтажный кирпичный дом. Удобное расположение, через дорогу конечная остановка общественного транспорта.
Планировки квартир очень удобные, цена выгодная, строится быстро. Рекомендую! Кому интересно, пишите","На Фестивальной","41.010738,57.754097"
"1711210057-61","https://yandex.ru/maps/org/na_festivalnoy/110497347496/","Отзывы","https://yandex.ru/maps/org/na_festivalnoy/110497347496/reviews/","Наталия Быстрова","Очень бы хотелось там жить! А почему бы и нет, надо стремиться!","На Фестивальной","41.010738,57.754097"
"1711210057-62","https://yandex.ru/maps/org/na_festivalnoy/110497347496/","Отзывы","https://yandex.ru/maps/org/na_festivalnoy/110497347496/reviews/","Инкогнито 2247","Класс","На Фестивальной","41.010738,57.754097"
"1711210057-63","https://yandex.ru/maps/org/na_festivalnoy/110497347496/","Отзывы","https://yandex.ru/maps/org/na_festivalnoy/110497347496/reviews/","Игорь Смирнов","Прекрасное место","На Фестивальной","41.010738,57.754097"
